{
  "name": "pleach",
  "summary": "deterministic conductor for DAGs of verified agent work; isolates each plan node in a git worktree and publishes only verified work",
  "kind": [
    "conductor"
  ],
  "version": "0.0.1",
  "install": {
    "npm": "pleach"
  },
  "faces": {
    "cli": "pleach",
    "skill": ".claude/skills/pleach-plan/SKILL.md"
  },
  "check": null,
  "metric": "bun run check",
  "context": {
    "upfront_tokens": null
  },
  "coverage": {
    "languages": [],
    "kinds": []
  },
  "flagged": [
    {
      "what": "check",
      "why": "pleach ships no gate of its own; building-the-garden.md mandates pleach adopt `weeder check --strict` as its default smoke rather than judging diffs itself, so check is null here."
    },
    {
      "what": "metric",
      "why": "pleach's declared metric is verified-close rate and human interventions per feature (docs/plotplot-architecture-review-2026-09.md \u00a711), qualitative and not yet scripted; this fixture uses the repository's real `bun run check` (typecheck, lint, test) as an honest interim stand-in."
    },
    {
      "what": "context.upfront_tokens",
      "why": "no measured figure found for the pleach-plan skill."
    },
    {
      "what": "coverage",
      "why": "pleach treats worker output as opaque git diffs and exit codes; it does not parse a target repository's source language, so both lists are empty on purpose."
    }
  ]
}
